{
  "schema_version": "townsquare-vertical-filing-draft-v1",
  "status": "DRAFT_NOT_FILED",
  "project": "townsquare",
  "program_key": "TOWNSQUARE-WORKING-DEFAULT",
  "filing_coordination": {
    "designated_writer": "eddie-brock",
    "coordination_hub_reference": "operator-designated Eddie Brock coordination hub",
    "serialization_protocol": [
      "Immediately before each append, re-scan the authoritative ledger for the proposed stable key and retrieve the current head of every declared parent and dependency.",
      "Append exactly one OPEN event through the authorized operation; no concurrent or batch appender may act.",
      "Read back and verify the exact event identity, stable key, state, content hash, parent/dependency bindings, and resulting authoritative head before considering the next event.",
      "If any key collision, new head, stale revision, or verification mismatch appears, stop; do not append the next event; coordinate through the operator-designated Eddie Brock coordination hub and rebase plus re-review the affected draft."
    ],
    "conflict_action": "STOP_REBASE_REREVIEW"
  },
  "source_refs": [
    "docs/townsquare-default/townsquare-working-default-architecture-and-draft-vertical.md#sha256=2016DCC680DC90CE788894E6F24D38BE65FD94CF999FA77D6B35BF8BFAABDE2A",
    "docs/townsquare-default/operator-planning-approval-20261009.md#decision=TSDEF-PLANNING-APPROVAL-20261009T095814684Z",
    "docs/townsquare-default/jigoro-kano-town-square-default-gate-review-addendum-20261009.md#sha256=7A258BFF05CA7E8D4C5C93ED8AC36543FF1F37016B2B20FC2EA1B1F93E8EEE5F",
    "docs/townsquare-default/gsp-townsquare-default-security-privacy-review-20261009.md#sha256=08F42DDD858348B3EE79F255D757223D6EFB3061D16F0A7388523C1668D0436A",
    "docs/townsquare-default/vertical-drafts/operator-ruling-and-security-delta-20261009.md"
  ],
  "items": [
    {
      "proposal_ref": "DRAFT-TSDEF-E1",
      "work_item_key": "TOWNSQUARE-WORKING-DEFAULT",
      "title": "TownSquare Working Default",
      "vertical_level": "EPIC",
      "parent_key": null,
      "depends_on_keys": ["YNM-EPIC-022"],
      "owner": "eddie-brock",
      "addressee": "bruce-lee",
      "review_owner": "gsp",
      "operator_acceptance_owner": "operator",
      "environment": "Sentinel One development; NAS production",
      "state": "OPEN",
      "implementation_authorized": true,
      "dispatch_authorized_by_this_draft": false,
      "priority": "TOP",
      "goal": "Make TownSquare the normal operator engagement, communication, audit, routing, and outcome interface while Drive becomes reconciled history and material actions remain exact-action governed.",
      "acceptance_criteria": [
        {"ref": "TOWNSQUARE-WORKING-DEFAULT:AC01", "text": "Every supported operator engagement creates one immutable receipt with protected exact evidence and causal attribution before disposition returns."},
        {"ref": "TOWNSQUARE-WORKING-DEFAULT:AC02", "text": "Ordinary authenticated audit intake needs no per-message action permit; every material action fails without exact applicable authority and a safe permit trace."},
        {"ref": "TOWNSQUARE-WORKING-DEFAULT:AC03", "text": "Canonical Registry and Revere work is reconciled without duplicate replacement items and completes under its own accepted criteria."},
        {"ref": "TOWNSQUARE-WORKING-DEFAULT:AC04", "text": "Town Watch and approved clients use native TownSquare intake and Revere transport without Drive publication or manual prompt relay."},
        {"ref": "TOWNSQUARE-WORKING-DEFAULT:AC05", "text": "An independently verified release is restored in isolation and promoted to NAS only under exact authorization, with no unreconciled accepted Drive record."},
        {"ref": "TOWNSQUARE-WORKING-DEFAULT:AC06", "text": "The operator records independent acceptance; Crier visibility, message delivery, or implementer self-review is insufficient."},
        {"ref": "TOWNSQUARE-WORKING-DEFAULT:AC07", "text": "Under the controlling operator ruling, Eddie Brock is product owner for all ongoing projects and coordinates code freezes and assignments through the operator-designated Eddie Brock coordination hub, but cannot self-review, independently accept, issue permits by role alone, authorize deployment/rollback/cutover or external contact, or authorize probe cleanup. Any session-to-hub mapping exists only in protected Registry evidence, never in filing drafts or native events."},
        {"ref": "TOWNSQUARE-WORKING-DEFAULT:AC08", "text": "Authoritative filing is serialized by the one designated writer: immediately re-scan key and current parent/dependency heads before each append, append exactly one event, verify its exact event/head, and stop for hub-coordinated rebase and re-review on any collision, new head, stale revision, or mismatch."}
      ],
      "evidence_required": ["accepted Feature references", "operator product-owner ruling", "historical product-owner role inventory", "code-freeze and assignment coordination record", "per-event serialized filing transcript", "end-to-end causal trace", "permit positive/negative matrix", "live-item reconciliation map", "client receipt report", "Drive reconciliation report", "release/restore/promotion evidence", "operator acceptance Decision"],
      "separate_authority_required": ["probe cleanup", "live external Revere proof", "NAS deployment or rollback", "Drive cutover"],
      "native_open_event": {"revision": "new", "idempotency_key": "open:TOWNSQUARE-WORKING-DEFAULT:v1", "payload": {"thread_id": "TOWNSQUARE-WORKING-DEFAULT", "kind": "REQUEST", "state": "OPEN", "body": "# TownSquare Working Default\n\nProgram Epic. Eddie coordinates freezes and assignments through the operator-designated Eddie Brock coordination hub while independent review, acceptance, and exact-action authorities remain separate. Any session-to-hub mapping belongs only in protected Registry evidence and is excluded from filing drafts and native events.", "media_type": "text/markdown", "sensitivity": "RESTRICTED", "owner": "eddie-brock", "addressee": "bruce-lee", "criteria_refs": ["TOWNSQUARE-WORKING-DEFAULT:AC01", "TOWNSQUARE-WORKING-DEFAULT:AC02", "TOWNSQUARE-WORKING-DEFAULT:AC03", "TOWNSQUARE-WORKING-DEFAULT:AC04", "TOWNSQUARE-WORKING-DEFAULT:AC05", "TOWNSQUARE-WORKING-DEFAULT:AC06", "TOWNSQUARE-WORKING-DEFAULT:AC07", "TOWNSQUARE-WORKING-DEFAULT:AC08"], "work_item_key": "TOWNSQUARE-WORKING-DEFAULT", "level": "EPIC", "parent": null, "dependencies": ["YNM-EPIC-022"], "implementation_authorized": true, "dispatch_authorized_by_this_draft": false, "environment": "Sentinel One development; NAS production", "review_owner": "gsp", "operator_acceptance_owner": "operator", "coordination_scope": "code freezes, assignments, and serialized filing through the operator-designated Eddie Brock coordination hub; session-to-hub mapping remains protected Registry evidence only", "designated_append_writer": "eddie-brock", "append_conflict_action": "STOP_REBASE_REREVIEW", "withheld_authorities": ["self-review", "independent acceptance", "permit issuance by role alone", "deployment", "rollback", "cutover", "external contact", "probe cleanup"]}}
    },
    {
      "proposal_ref": "DRAFT-TSDEF-F1",
      "work_item_key": "TOWNSQUARE-GOVERNANCE-AUTHORITY-BOOTSTRAP",
      "title": "Trio governance and non-circular authority bootstrap",
      "vertical_level": "FEATURE",
      "parent_key": "TOWNSQUARE-WORKING-DEFAULT",
      "depends_on_keys": [],
      "owner": "eddie-brock",
      "addressee": "bruce-lee",
      "review_owner": "gsp",
      "operator_acceptance_owner": "operator",
      "environment": "Sentinel One development",
      "state": "OPEN",
      "implementation_authorized": true,
      "dispatch_authorized_by_this_draft": false,
      "priority": "HIGH",
      "goal": "Bind the adopted Charter to TownSquare, Vertical, and Iron Curtain and integrate the canonical exact-action permit without blocking non-authorizing audit intake.",
      "acceptance_criteria": [
        {"ref": "TOWNSQUARE-GOVERNANCE-AUTHORITY-BOOTSTRAP:AC01", "text": "Both child Stories are independently accepted."},
        {"ref": "TOWNSQUARE-GOVERNANCE-AUTHORITY-BOOTSTRAP:AC02", "text": "The action matrix covers every MVP endpoint and defaults unknown writing routes to deny."},
        {"ref": "TOWNSQUARE-GOVERNANCE-AUTHORITY-BOOTSTRAP:AC03", "text": "The canonical exact-action contract is unchanged; no reusable or generalized capability subsystem is introduced."}
      ],
      "evidence_required": ["accepted child Story references", "exhaustive action matrix", "default-deny test result", "canonical permit regression result"],
      "separate_authority_required": ["permit issuance or activation in a live environment"],
      "native_open_event": {"revision": "new", "idempotency_key": "open:TOWNSQUARE-GOVERNANCE-AUTHORITY-BOOTSTRAP:v1", "payload": {"thread_id": "TOWNSQUARE-GOVERNANCE-AUTHORITY-BOOTSTRAP", "kind": "REQUEST", "state": "OPEN", "body": "# Trio governance and non-circular authority bootstrap\n\nFeature containing the Charter/action-matrix and exact-action integration Stories.", "media_type": "text/markdown", "sensitivity": "RESTRICTED", "owner": "eddie-brock", "addressee": "bruce-lee", "criteria_refs": ["TOWNSQUARE-GOVERNANCE-AUTHORITY-BOOTSTRAP:AC01", "TOWNSQUARE-GOVERNANCE-AUTHORITY-BOOTSTRAP:AC02", "TOWNSQUARE-GOVERNANCE-AUTHORITY-BOOTSTRAP:AC03"], "work_item_key": "TOWNSQUARE-GOVERNANCE-AUTHORITY-BOOTSTRAP", "level": "FEATURE", "parent": "TOWNSQUARE-WORKING-DEFAULT", "dependencies": [], "implementation_authorized": true, "dispatch_authorized_by_this_draft": false, "environment": "Sentinel One development", "review_owner": "gsp", "operator_acceptance_owner": "operator"}}
    },
    {
      "proposal_ref": "DRAFT-TSDEF-S1",
      "work_item_key": "TOWNSQUARE-CHARTER-ACTION-MATRIX",
      "title": "Extend the adopted Charter with trio bindings and action matrix",
      "vertical_level": "STORY",